{
  "$schema": "http://json-schema.org/draft-07/schema#",
  "$id": "https://unpkg.com/@yyamamoto95/flow-wireframe/schema/flow-wireframe.schema.json",
  "title": "flow-wireframe フロー定義",
  "description": "業務フロー定義。screens（画面カタログ）と flows（ユーザーストーリー単位の業務フロー）で構成する。",
  "type": "object",
  "required": ["title", "screens", "flows"],
  "additionalProperties": false,
  "properties": {
    "$schema": { "type": "string" },
    "title": { "type": "string", "description": "ドキュメント名" },
    "description": { "type": "string", "description": "ドキュメントの説明" },
    "version": { "type": "string", "description": "定義のバージョン。出力HTMLに表示される" },
    "accent": { "type": "string", "description": "アクセントカラー（CSSカラー値）" },
    "screens": {
      "type": "array",
      "minItems": 1,
      "items": { "$ref": "#/definitions/screen" }
    },
    "flows": {
      "type": "array",
      "minItems": 1,
      "items": { "$ref": "#/definitions/flow" }
    }
  },
  "definitions": {
    "screen": {
      "type": "object",
      "required": ["id", "name", "elements"],
      "additionalProperties": false,
      "properties": {
        "id": { "type": "string", "description": "フロー・goto から参照する一意なID" },
        "name": { "type": "string", "description": "画面名" },
        "note": { "type": "string", "description": "画面の目的や状態の説明" },
        "layout": { "enum": ["mobile", "desktop"], "description": "mobile=スマホ枠(320px) / desktop=ブラウザ枠(560px)。省略時は mobile" },
        "elements": {
          "type": "array",
          "items": { "$ref": "#/definitions/element" }
        }
      }
    },
    "element": {
      "type": "object",
      "required": ["type"],
      "properties": {
        "type": {
          "enum": ["header", "text", "input", "button", "link", "list", "card", "chart", "image", "badge", "choice", "nav", "divider"]
        },
        "note": { "type": "string", "description": "①②…として画面下の注釈リストに表示される補足" }
      },
      "allOf": [
        {
          "if": { "properties": { "type": { "const": "header" } } },
          "then": { "required": ["type", "label"], "properties": { "label": { "type": "string" } } }
        },
        {
          "if": { "properties": { "type": { "const": "text" } } },
          "then": {
            "required": ["type", "label"],
            "properties": { "label": { "type": "string" }, "muted": { "type": "boolean" } }
          }
        },
        {
          "if": { "properties": { "type": { "const": "input" } } },
          "then": {
            "required": ["type", "label"],
            "properties": {
              "label": { "type": "string" },
              "placeholder": { "type": "string" },
              "secret": { "type": "boolean" }
            }
          }
        },
        {
          "if": { "properties": { "type": { "const": "button" } } },
          "then": {
            "required": ["type", "label"],
            "properties": {
              "label": { "type": "string" },
              "goto": { "type": "string", "description": "クリックで遷移する画面ID" },
              "variant": { "enum": ["primary", "secondary", "danger"] },
              "external": { "type": "boolean", "description": "外部サービスへの遷移（↗表示）" }
            }
          }
        },
        {
          "if": { "properties": { "type": { "const": "link" } } },
          "then": {
            "required": ["type", "label"],
            "properties": {
              "label": { "type": "string" },
              "goto": { "type": "string" },
              "external": { "type": "boolean" }
            }
          }
        },
        {
          "if": { "properties": { "type": { "const": "list" } } },
          "then": {
            "required": ["type", "items"],
            "properties": {
              "label": { "type": "string" },
              "items": { "type": "array", "items": { "type": "string" } }
            }
          }
        },
        {
          "if": { "properties": { "type": { "const": "card" } } },
          "then": {
            "required": ["type", "label"],
            "properties": {
              "label": { "type": "string" },
              "value": { "type": "string", "description": "カードの主役となる値（例: ¥1,280）" },
              "caption": { "type": "string" }
            }
          }
        },
        {
          "if": { "properties": { "type": { "const": "chart" } } },
          "then": {
            "properties": {
              "label": { "type": "string" },
              "kind": { "enum": ["bar", "line", "donut"] }
            }
          }
        },
        {
          "if": { "properties": { "type": { "const": "image" } } },
          "then": { "properties": { "label": { "type": "string" } } }
        },
        {
          "if": { "properties": { "type": { "const": "badge" } } },
          "then": {
            "required": ["type", "label"],
            "properties": {
              "label": { "type": "string" },
              "tone": { "enum": ["good", "caution", "neutral"] }
            }
          }
        },
        {
          "if": { "properties": { "type": { "const": "choice" } } },
          "then": {
            "required": ["type", "items"],
            "properties": {
              "label": { "type": "string" },
              "items": { "type": "array", "items": { "type": "string" } },
              "selected": { "type": "string" }
            }
          }
        },
        {
          "if": { "properties": { "type": { "const": "nav" } } },
          "then": {
            "required": ["type", "items"],
            "properties": {
              "items": {
                "type": "array",
                "items": {
                  "oneOf": [
                    { "type": "string" },
                    {
                      "type": "object",
                      "required": ["label"],
                      "additionalProperties": false,
                      "properties": {
                        "label": { "type": "string" },
                        "goto": { "type": "string" }
                      }
                    }
                  ]
                }
              },
              "selected": { "type": "string" }
            }
          }
        }
      ]
    },
    "flow": {
      "type": "object",
      "required": ["id", "name", "steps"],
      "additionalProperties": false,
      "properties": {
        "id": { "type": "string", "description": "トレーサビリティID（例: US-301）" },
        "name": { "type": "string" },
        "actor": { "type": "string", "description": "フローの主体（例: 利用者、システム）" },
        "description": { "type": "string" },
        "scenario": {
          "type": "object",
          "required": ["given", "when", "then"],
          "additionalProperties": false,
          "properties": {
            "given": { "type": "array", "items": { "type": "string" }, "description": "前提" },
            "when": { "type": "array", "items": { "type": "string" }, "description": "操作" },
            "then": { "type": "array", "items": { "type": "string" }, "description": "結果" }
          }
        },
        "steps": {
          "type": "array",
          "minItems": 1,
          "items": {
            "type": "object",
            "additionalProperties": false,
            "properties": {
              "screen": { "type": "string", "description": "表示する画面のID（process と排他）" },
              "process": { "type": "string", "description": "画面を持たない処理の名前（screen と排他）" },
              "actor": { "type": "string", "description": "このステップの主体。省略時はフローの actor" },
              "action": { "type": "string", "description": "次のステップへの矢印ラベル" },
              "result": { "type": "string", "description": "システムの応答・特記事項" }
            },
            "oneOf": [{ "required": ["screen"] }, { "required": ["process"] }]
          }
        }
      }
    }
  }
}
