{
  "$schema": "../schema/flow-wireframe.schema.json",
  "title": "家計簿アプリ 業務フロー ワイヤーフレーム",
  "description": "BDD ユーザーストーリー（.github/spec/user-stories.md）の代表フローを見える化したもの。ID はストーリーの US-nnn と対応する。",
  "version": "0.1.0",
  "screens": [
    {
      "id": "login",
      "name": "ログイン画面",
      "note": "アプリの入口。登録済みユーザーのログインと、登録なしで試せるゲストログインを提供する。",
      "elements": [
        { "type": "header", "label": "家計簿アプリ" },
        { "type": "text", "label": "おかえりなさい。今日も記録からはじめましょう。", "muted": true },
        { "type": "input", "label": "ユーザーID", "placeholder": "例: yamada_taro" },
        { "type": "input", "label": "パスワード", "secret": true },
        { "type": "button", "label": "ログイン", "goto": "home", "note": "認証成功でホームへ。失敗時はエラーを表示して再入力を促す" },
        { "type": "divider" },
        { "type": "link", "label": "ゲストとして試す", "goto": "home", "note": "アカウントなしで主要機能を体験できる（US-003）" },
        { "type": "link", "label": "パスワードを忘れた（秘密の質問）" }
      ]
    },
    {
      "id": "home",
      "name": "ホーム画面",
      "note": "アプリを開いた瞬間に「今日の状況」を一瞥できる画面。数字が主役で、煽る演出はしない。",
      "elements": [
        { "type": "header", "label": "ホーム" },
        { "type": "card", "label": "今日使える残り予算", "value": "¥1,280", "caption": "給料日まであと 12 日", "note": "日割り残り予算ヒーロー。支出記録のたびに即時更新（US-101）" },
        { "type": "badge", "label": "良いペース", "tone": "good", "note": "ペースが「良い／注意」かをひと目で示す" },
        { "type": "card", "label": "生活余力", "value": "生活費 3.2ヶ月分", "caption": "先月より +0.3ヶ月分", "note": "総資産と実効支出から算出。算出不能時は理由と次の行動を案内（US-402）" },
        { "type": "list", "label": "今月の収支サマリー", "items": ["収入  ¥280,000", "支出  ¥163,200", "収支  +¥116,800（貯蓄率 41%）"] },
        { "type": "list", "label": "最近の記録（直近3日）", "items": ["今日　食費　¥820", "昨日　交通　¥340", "昨日　食費　¥1,200"] },
        { "type": "button", "label": "＋ 記録する", "goto": "quick-record", "note": "最速入力への導線。ホームから1タップで開く" },
        { "type": "nav", "items": ["ホーム", "記録", "明細", { "label": "レポート", "goto": "report" }, "設定"], "selected": "ホーム" }
      ]
    },
    {
      "id": "quick-record",
      "name": "クイック入力",
      "note": "最小操作（カテゴリ選択＋金額）で記録を完了させる。迷わせないことが最優先。",
      "elements": [
        { "type": "header", "label": "記録する" },
        { "type": "choice", "label": "種別", "items": ["支出", "収入"], "selected": "支出", "note": "収入はタブ切替で記録できる（US-301）" },
        { "type": "choice", "label": "カテゴリ", "items": ["食費", "交通", "日用品", "その他"], "selected": "食費" },
        { "type": "input", "label": "金額", "placeholder": "¥ 0", "note": "金額が空のままでは登録できない（バリデーション）" },
        { "type": "button", "label": "登録する", "goto": "home-recorded" },
        { "type": "link", "label": "日付・メモも入力する（詳細フォームへ）" },
        { "type": "link", "label": "キャンセル", "goto": "home" }
      ]
    },
    {
      "id": "home-recorded",
      "name": "ホーム画面（記録直後）",
      "note": "登録成功のフィードバックと、記録が数字に反映されたことを同じ画面で確認できる状態。",
      "elements": [
        { "type": "header", "label": "ホーム" },
        { "type": "badge", "label": "✓ 記録しました（生活余力 −1日分）", "tone": "good", "note": "登録成功の表示とあわせて生活余力への影響を添える。影響が小さい場合は「ほぼ変わりません」" },
        { "type": "card", "label": "今日使える残り予算", "value": "¥460", "caption": "¥1,280 → ¥460 に即時更新", "note": "残り予算・消化率が記録直後に更新される（US-101）" },
        { "type": "list", "label": "最近の記録（直近3日）", "items": ["今日　食費　¥820 ← いま記録した明細", "昨日　交通　¥340", "昨日　食費　¥1,200"] },
        { "type": "button", "label": "＋ 続けて記録する", "goto": "quick-record" },
        { "type": "nav", "items": ["ホーム", "記録", "明細", { "label": "レポート", "goto": "report" }, "設定"], "selected": "ホーム" }
      ]
    },
    {
      "id": "report",
      "name": "レポート画面",
      "note": "カテゴリ別の支出内訳と期間切替。どのカテゴリが突出しているかに気づける。",
      "elements": [
        { "type": "header", "label": "レポート" },
        { "type": "choice", "label": "期間", "items": ["今月", "直近7日", "先月"], "selected": "今月", "note": "期間はURLに反映され、リンク共有・再訪問時も同じ期間で表示される" },
        { "type": "chart", "label": "カテゴリ別支出割合", "kind": "donut" },
        { "type": "list", "label": "カテゴリ内訳", "items": ["食費　　¥62,400（38%）", "住居　　¥55,000（34%）", "交通　　¥28,100（17%）", "日用品　¥17,700（11%）"] },
        { "type": "text", "label": "食費が先月より +12% 増えています", "muted": true, "note": "突出カテゴリへの気づきを事実の数字で示す（煽らない）" },
        { "type": "nav", "items": [{ "label": "ホーム", "goto": "home" }, "記録", "明細", "レポート", "設定"], "selected": "レポート" }
      ]
    }
  ],
  "flows": [
    {
      "id": "US-002",
      "name": "ログインする",
      "actor": "利用者",
      "description": "登録済みユーザーが自分のデータにアクセスするまでの流れ。",
      "scenario": {
        "given": ["登録済みのアカウントがある"],
        "when": ["ユーザーIDとパスワードを入力してログインする"],
        "then": ["ホーム画面に遷移する", "自分のデータ（記録・設定）が表示される"]
      },
      "steps": [
        { "screen": "login", "action": "ID・パスワードを入力して「ログイン」" },
        { "screen": "home", "result": "自分のデータが表示される" }
      ]
    },
    {
      "id": "US-301",
      "name": "支出を素早く記録する（クイック入力）",
      "actor": "利用者",
      "description": "記録の心理的コストを最小にする、このアプリの中核フロー。",
      "scenario": {
        "given": ["ユーザーがアプリを開いている"],
        "when": ["クイック入力でカテゴリを選んで金額を入力する"],
        "then": [
          "記録が完了し「記録した」というフィードバックが得られる",
          "今日の残り予算が即座に更新される",
          "明細一覧に反映される"
        ]
      },
      "steps": [
        { "screen": "home", "action": "「＋ 記録する」をタップ" },
        { "screen": "quick-record", "action": "カテゴリを選び金額を入力して「登録する」", "result": "空の金額はバリデーションで弾く" },
        { "screen": "home-recorded", "result": "残り予算と明細が即時更新" }
      ]
    },
    {
      "id": "US-401",
      "name": "ホーム画面でその日の状況を一瞥する",
      "actor": "利用者",
      "description": "アプリを開いた瞬間に「今日何をすべきか」が判断できる状態をつくる。生活余力（US-402）も同じ画面で確認する。",
      "scenario": {
        "given": ["初回設定が完了しており、過去の記録がある"],
        "when": ["ユーザーがアプリを開く"],
        "then": [
          "今日使える予算・今日の支出・給料日までの残り日数が1画面で確認できる",
          "「生活費◯ヶ月分」の形式で生活余力が表示される",
          "「今日何をすべきか（記録する / 支出を抑える）」が判断できる状態になる"
        ]
      },
      "steps": [
        { "screen": "home", "result": "1画面で状況把握が完了" }
      ]
    },
    {
      "id": "US-102",
      "name": "使いすぎているカテゴリに気づく",
      "actor": "利用者",
      "description": "レポートでカテゴリ別の内訳と期間比較を確認する。",
      "scenario": {
        "given": ["対象期間の支出記録が複数ある"],
        "when": ["ユーザーがレポートを確認する", "期間を「今月／直近7日／先月」で切り替える"],
        "then": ["カテゴリ別の支出割合が表示される", "どのカテゴリが突出しているかわかる", "選択した期間の集計に表示が切り替わる"]
      },
      "steps": [
        { "screen": "home", "action": "ナビの「レポート」をタップ" },
        { "screen": "report", "result": "突出カテゴリに気づける" }
      ]
    }
  ]
}
